[
  {
    "id": "fotografie-forum-monschau",
    "name": "Fotografie-Forum der StädteRegion Aachen",
    "shortName": "Fotografie-Forum Monschau",
    "type": "museum",
    "city": "Monschau",
    "address": {
      "street": "Austraße 9",
      "zip": "52156",
      "city": "Monschau",
      "lat": 50.5549015,
      "lng": 6.2442923
    },
    "website": "https://www.kuk-monschau.de/",
    "features": {
      "hasPermanentCollection": true,
      "hasReferenceLibrary": false
    },
    "source": {
      "url": "https://www.kuk-monschau.de/index.php/ausstellungen/ausstellungen-2026/94-j%C3%BCrgen-klauke-08-11-2026%E2%80%9320-12-2026.html",
      "checkedAt": "2026-10-27",
      "status": "recherchiert"
    }
  },
  {
    "id": "makk-koeln",
    "name": "Museum für Angewandte Kunst Köln",
    "shortName": "MAKK",
    "type": "museum",
    "city": "Köln",
    "district": "Altstadt-Nord",
    "address": {
      "street": "An der Rechtschule 7",
      "zip": "50667",
      "city": "Köln",
      "lat": 50.9397621,
      "lng": 6.9545341
    },
    "website": "https://www.makk.de/",
    "features": {
      "hasPermanentCollection": true,
      "hasReferenceLibrary": false
    },
    "source": {
      "url": "https://makk.de/besuchen/ausstellungen/sonderausstellungen/der-architektonische-blick-epochal-global",
      "checkedAt": "2026-10-27",
      "status": "recherchiert"
    }
  },
  {
    "id": "museum-ludwig-koeln",
    "name": "Museum Ludwig",
    "shortName": "Museum Ludwig",
    "type": "museum",
    "city": "Köln",
    "district": "Altstadt-Nord",
    "address": {
      "street": "Heinrich-Böll-Platz",
      "zip": "50667",
      "city": "Köln",
      "lat": 50.9408347,
      "lng": 6.9600217
    },
    "website": "https://www.museum-ludwig.de/",
    "features": {
      "hasPermanentCollection": true,
      "hasReferenceLibrary": false
    },
    "source": {
      "url": "https://www.museum-ludwig.de/",
      "checkedAt": "2026-10-27",
      "status": "recherchiert"
    }
  },
  {
    "id": "photographische-sammlung-koeln",
    "name": "Die Photographische Sammlung/SK Stiftung Kultur",
    "shortName": "Photographische Sammlung",
    "type": "foundation",
    "city": "Köln",
    "district": "Neustadt-Nord",
    "address": {
      "street": "Im Mediapark 7",
      "zip": "50670",
      "city": "Köln",
      "lat": 50.9486933,
      "lng": 6.9433901
    },
    "website": "https://photographie-stiftungkultur.de/",
    "features": {
      "hasPermanentCollection": true,
      "hasReferenceLibrary": true,
      "libraryNotes": "Präsenzbibliothek mit über 7.200 Bänden, u. a. rund 900 Bände aus der Privatbibliothek August Sanders; Nutzung nur nach Terminabsprache, Mo–Do 8:30–13:30 Uhr."
    },
    "source": {
      "url": "https://photographie-stiftungkultur.de/ausstellungen",
      "checkedAt": "2026-10-27",
      "status": "recherchiert"
    }
  },
  {
    "id": "photobookmuseum-koeln",
    "name": "The PhotoBookMuseum",
    "shortName": "PhotoBookMuseum",
    "type": "museum",
    "city": "Köln",
    "district": "Ehrenfeld",
    "address": {
      "street": "Körnerstraße 6–8",
      "zip": "50823",
      "city": "Köln",
      "lat": 50.94819,
      "lng": 6.9218663
    },
    "website": "https://www.thephotobookmuseum.com/de",
    "features": {
      "hasPermanentCollection": true,
      "hasReferenceLibrary": false
    },
    "source": {
      "url": "https://www.thephotobookmuseum.com/de/allcategories-de-de/2-uncategorised/14-the-box-programm-de",
      "checkedAt": "2026-10-27",
      "status": "recherchiert"
    }
  },
  {
    "id": "kunst-und-museumsbibliothek-koeln",
    "name": "Kunst- und Museumsbibliothek der Stadt Köln",
    "shortName": "KMB Köln",
    "type": "library_archive",
    "city": "Köln",
    "district": "Altstadt-Nord",
    "address": {
      "street": "Heinrich-Böll-Platz/Bischofsgartenstraße 1",
      "zip": "50667",
      "city": "Köln",
      "lat": 50.9408347,
      "lng": 6.9600217
    },
    "website": "https://www.museenkoeln.de/kunst-und-museumsbibliothek/",
    "features": {
      "hasPermanentCollection": false,
      "hasReferenceLibrary": true,
      "libraryNotes": "Öffentliche Präsenzbibliothek im Museum Ludwig (Eingang Filmforum) mit über 600.000 Bänden; Sammelschwerpunkt u. a. Fotografie; Literatur vorab über den Online-Katalog bestellen."
    },
    "source": {
      "url": "https://www.stadt-koeln.de/service/adressen/kunst-und-museumsbibliothek",
      "checkedAt": "2026-10-27",
      "status": "recherchiert"
    }
  },
  {
    "id": "rheinisches-bildarchiv-koeln",
    "name": "Historisches Archiv mit Rheinischem Bildarchiv",
    "shortName": "Rheinisches Bildarchiv",
    "type": "library_archive",
    "city": "Köln",
    "district": "Neustadt-Süd",
    "address": {
      "street": "Eifelwall 5",
      "zip": "50674",
      "city": "Köln",
      "lat": 50.924158,
      "lng": 6.9381216
    },
    "website": "https://www.stadt-koeln.de/leben-in-koeln/kultur/rheinisches-bildarchiv/index.html",
    "features": {
      "hasPermanentCollection": true,
      "hasReferenceLibrary": false
    },
    "source": {
      "url": "https://www.stadt-koeln.de/leben-in-koeln/kultur/rheinisches-bildarchiv/index.html",
      "checkedAt": "2026-10-27",
      "status": "recherchiert"
    }
  },
  {
    "id": "zander-galerie-koeln",
    "name": "Zander Galerie",
    "shortName": "Zander Galerie",
    "type": "gallery",
    "city": "Köln",
    "district": "Bayenthal",
    "address": {
      "street": "Schönhauser Straße 8",
      "zip": "50968",
      "city": "Köln",
      "lat": 50.9137181,
      "lng": 6.9695619
    },
    "website": "https://zandergalerie.com/",
    "features": {
      "hasPermanentCollection": false,
      "hasReferenceLibrary": false
    },
    "source": {
      "url": "https://zandergalerie.com/exhibitions/silver-shadows-a54844c5/",
      "checkedAt": "2026-10-27",
      "status": "recherchiert"
    }
  },
  {
    "id": "galerie-lichtblick-koeln",
    "name": "Galerie Lichtblick – Gesellschaft für fotografische Kunst e.V.",
    "shortName": "Galerie Lichtblick",
    "type": "gallery",
    "city": "Köln",
    "district": "Nippes",
    "address": {
      "street": "Steinberger Straße 21",
      "zip": "50733",
      "city": "Köln",
      "lat": 50.9614667,
      "lng": 6.9510975
    },
    "website": "https://www.lichtblicknet.com/",
    "features": {
      "hasPermanentCollection": false,
      "hasReferenceLibrary": false
    },
    "source": {
      "url": "https://www.lichtblicknet.com/aktuell/index.html",
      "checkedAt": "2026-10-27",
      "status": "recherchiert"
    }
  },
  {
    "id": "kaune-contemporary-koeln",
    "name": "Kaune Contemporary Gallery",
    "shortName": "Kaune Contemporary",
    "type": "gallery",
    "city": "Köln",
    "district": "Altstadt-Nord",
    "address": {
      "street": "Gereonskloster 12",
      "zip": "50670",
      "city": "Köln",
      "lat": 50.9433859,
      "lng": 6.9444626
    },
    "website": "https://www.kaunegallery.com/",
    "features": {
      "hasPermanentCollection": false,
      "hasReferenceLibrary": false
    },
    "source": {
      "url": "https://www.kaunegallery.com/exhibitions/hg-esch-anthroposcape/",
      "checkedAt": "2026-10-27",
      "status": "recherchiert"
    }
  },
  {
    "id": "kunstpalast-duesseldorf",
    "name": "Museum Kunstpalast",
    "shortName": "Kunstpalast",
    "type": "museum",
    "city": "Düsseldorf",
    "district": "Pempelfort",
    "address": {
      "street": "Ehrenhof 4–5",
      "zip": "40479",
      "city": "Düsseldorf",
      "lat": 51.234998,
      "lng": 6.7731045
    },
    "website": "https://www.kunstpalast.de/",
    "features": {
      "hasPermanentCollection": true,
      "hasReferenceLibrary": false
    },
    "source": {
      "url": "https://www.kunstpalast.de/de/programm/sammlung/die-sammlung-fotografie/",
      "checkedAt": "2026-10-27",
      "status": "recherchiert"
    }
  },
  {
    "id": "nrw-forum-duesseldorf",
    "name": "NRW-Forum Düsseldorf",
    "shortName": "NRW-Forum",
    "type": "museum",
    "city": "Düsseldorf",
    "district": "Pempelfort",
    "address": {
      "street": "Ehrenhof 2",
      "zip": "40479",
      "city": "Düsseldorf",
      "lat": 51.2332092,
      "lng": 6.7720702
    },
    "website": "https://www.nrw-forum.de/",
    "features": {
      "hasPermanentCollection": false,
      "hasReferenceLibrary": false
    },
    "source": {
      "url": "https://www.nrw-forum.de/",
      "checkedAt": "2026-10-27",
      "status": "recherchiert"
    }
  },
  {
    "id": "museum-folkwang-essen",
    "name": "Museum Folkwang",
    "shortName": "Folkwang",
    "type": "museum",
    "city": "Essen",
    "district": "Südviertel",
    "address": {
      "street": "Museumsplatz 1",
      "zip": "45128",
      "city": "Essen",
      "lat": 51.4425294,
      "lng": 7.0047432
    },
    "website": "https://www.museum-folkwang.de/",
    "features": {
      "hasPermanentCollection": true,
      "hasReferenceLibrary": true,
      "libraryNotes": "Bibliothek mit über 50.000 Werken, u. a. zu Fotografie; Benutzung vor Ort nach Anmeldung Di–Fr; Fotografien und Grafik donnerstags nach Anmeldung einsehbar."
    },
    "source": {
      "url": "https://www.museum-folkwang.de/en/exhibitions",
      "checkedAt": "2026-10-27",
      "status": "recherchiert"
    }
  },
  {
    "id": "ruhr-museum-essen",
    "name": "Ruhr Museum",
    "shortName": "Ruhr Museum",
    "type": "museum",
    "city": "Essen",
    "district": "Stoppenberg",
    "address": {
      "street": "Gelsenkirchener Straße 181",
      "zip": "45309",
      "city": "Essen",
      "lat": 51.485864,
      "lng": 7.0421874
    },
    "website": "https://ruhrmuseum.de/",
    "features": {
      "hasPermanentCollection": true,
      "hasReferenceLibrary": false
    },
    "source": {
      "url": "https://ruhrmuseum.de/en/museum/collections/photography",
      "checkedAt": "2026-10-27",